[
  {
    "hexagram_seq": 1,
    "position": 1,
    "line_label": "初九",
    "text": "初九：潜龙勿用。",
    "source_id": "wikisource_zhouyi",
    "status": "checked",
    "edition": "Wikisource zh-hans HTML page scrape",
    "source_locator": "周易/乾/易经/初九"
  },
  {
    "hexagram_seq": 1,
    "position": 2,
    "line_label": "九二",
    "text": "九二：见龙在田，利见大人。",
    "source_id": "wikisource_zhouyi",
    "status": "checked",
    "edition": "Wikisource zh-hans HTML page scrape",
    "source_locator": "周易/乾/易经/九二"
  },
  {
    "hexagram_seq": 1,
    "position": 3,
    "line_label": "九三",
    "text": "九三：君子终日乾乾，夕惕若；厉，无咎。",
    "source_id": "wikisource_zhouyi",
    "status": "checked",
    "edition": "Wikisource zh-hans HTML page scrape",
    "source_locator": "周易/乾/易经/九三"
  },
  {
    "hexagram_seq": 1,
    "position": 4,
    "line_label": "九四",
    "text": "九四：或跃在渊，无咎。",
    "source_id": "wikisource_zhouyi",
    "status": "checked",
    "edition": "Wikisource zh-hans HTML page scrape",
    "source_locator": "周易/乾/易经/九四"
  },
  {
    "hexagram_seq": 1,
    "position": 5,
    "line_label": "九五",
    "text": "九五：飞龙在天，利见大人。",
    "source_id": "wikisource_zhouyi",
    "status": "checked",
    "edition": "Wikisource zh-hans HTML page scrape",
    "source_locator": "周易/乾/易经/九五"
  },
  {
    "hexagram_seq": 1,
    "position": 6,
    "line_label": "上九",
    "text": "上九：亢龙，有悔。",
    "source_id": "wikisource_zhouyi",
    "status": "checked",
    "edition": "Wikisource zh-hans HTML page scrape",
    "source_locator": "周易/乾/易经/上九"
  },
  {
    "hexagram_seq": 2,
    "position": 1,
    "line_label": "初六",
    "text": "初六：履霜，坚冰至。",
    "source_id": "wikisource_zhouyi",
    "status": "checked",
    "edition": "Wikisource zh-hans HTML page scrape",
    "source_locator": "周易/坤/易经/初六"
  },
  {
    "hexagram_seq": 2,
    "position": 2,
    "line_label": "六二",
    "text": "六二：直方大，不习无不利。",
    "source_id": "wikisource_zhouyi",
    "status": "checked",
    "edition": "Wikisource zh-hans HTML page scrape",
    "source_locator": "周易/坤/易经/六二"
  },
  {
    "hexagram_seq": 2,
    "position": 3,
    "line_label": "六三",
    "text": "六三：含章，可贞。或从王事，无成有终。",
    "source_id": "wikisource_zhouyi",
    "status": "checked",
    "edition": "Wikisource zh-hans HTML page scrape",
    "source_locator": "周易/坤/易经/六三"
  },
  {
    "hexagram_seq": 2,
    "position": 4,
    "line_label": "六四",
    "text": "六四：括囊，无咎无誉。",
    "source_id": "wikisource_zhouyi",
    "status": "checked",
    "edition": "Wikisource zh-hans HTML page scrape",
    "source_locator": "周易/坤/易经/六四"
  },
  {
    "hexagram_seq": 2,
    "position": 5,
    "line_label": "六五",
    "text": "六五：黄裳，元吉。",
    "source_id": "wikisource_zhouyi",
    "status": "checked",
    "edition": "Wikisource zh-hans HTML page scrape",
    "source_locator": "周易/坤/易经/六五"
  },
  {
    "hexagram_seq": 2,
    "position": 6,
    "line_label": "上六",
    "text": "上六：龙战于野，其血玄黄。",
    "source_id": "wikisource_zhouyi",
    "status": "checked",
    "edition": "Wikisource zh-hans HTML page scrape",
    "source_locator": "周易/坤/易经/上六"
  },
  {
    "hexagram_seq": 3,
    "position": 1,
    "line_label": "初九",
    "text": "初九：磐桓，利居贞，利建侯。",
    "source_id": "wikisource_zhouyi",
    "status": "checked",
    "edition": "Wikisource zh-hans HTML page scrape",
    "source_locator": "周易/屯/易经/初九"
  },
  {
    "hexagram_seq": 3,
    "position": 2,
    "line_label": "六二",
    "text": "六二：屯如邅如，乘马班如，匪寇婚媾，女子贞不字，十年乃字。",
    "source_id": "wikisource_zhouyi",
    "status": "checked",
    "edition": "Wikisource zh-hans HTML page scrape",
    "source_locator": "周易/屯/易经/六二"
  },
  {
    "hexagram_seq": 3,
    "position": 3,
    "line_label": "六三",
    "text": "六三：即鹿无虞，惟入于林中，君子几不如舍，往吝。",
    "source_id": "wikisource_zhouyi",
    "status": "checked",
    "edition": "Wikisource zh-hans HTML page scrape",
    "source_locator": "周易/屯/易经/六三"
  },
  {
    "hexagram_seq": 3,
    "position": 4,
    "line_label": "六四",
    "text": "六四：乘马班如，求婚媾，往，吉无不利。",
    "source_id": "wikisource_zhouyi",
    "status": "checked",
    "edition": "Wikisource zh-hans HTML page scrape",
    "source_locator": "周易/屯/易经/六四"
  },
  {
    "hexagram_seq": 3,
    "position": 5,
    "line_label": "九五",
    "text": "九五：屯其膏；小贞吉，大贞凶。",
    "source_id": "wikisource_zhouyi",
    "status": "checked",
    "edition": "Wikisource zh-hans HTML page scrape",
    "source_locator": "周易/屯/易经/九五"
  },
  {
    "hexagram_seq": 3,
    "position": 6,
    "line_label": "上六",
    "text": "上六：乘马班如，泣血涟如。",
    "source_id": "wikisource_zhouyi",
    "status": "checked",
    "edition": "Wikisource zh-hans HTML page scrape",
    "source_locator": "周易/屯/易经/上六"
  },
  {
    "hexagram_seq": 4,
    "position": 1,
    "line_label": "初六",
    "text": "初六：发蒙，利用刑人，用说桎梏，以往吝。",
    "source_id": "wikisource_zhouyi",
    "status": "checked",
    "edition": "Wikisource zh-hans HTML page scrape",
    "source_locator": "周易/蒙/易经/初六"
  },
  {
    "hexagram_seq": 4,
    "position": 2,
    "line_label": "九二",
    "text": "九二：包蒙吉，纳妇吉，子克家。",
    "source_id": "wikisource_zhouyi",
    "status": "checked",
    "edition": "Wikisource zh-hans HTML page scrape",
    "source_locator": "周易/蒙/易经/九二"
  },
  {
    "hexagram_seq": 4,
    "position": 3,
    "line_label": "六三",
    "text": "六三：勿用取女，见金夫，不有躬，无攸利。",
    "source_id": "wikisource_zhouyi",
    "status": "checked",
    "edition": "Wikisource zh-hans HTML page scrape",
    "source_locator": "周易/蒙/易经/六三"
  },
  {
    "hexagram_seq": 4,
    "position": 4,
    "line_label": "六四",
    "text": "六四：困蒙，吝。",
    "source_id": "wikisource_zhouyi",
    "status": "checked",
    "edition": "Wikisource zh-hans HTML page scrape",
    "source_locator": "周易/蒙/易经/六四"
  },
  {
    "hexagram_seq": 4,
    "position": 5,
    "line_label": "六五",
    "text": "六五：童蒙，吉。",
    "source_id": "wikisource_zhouyi",
    "status": "checked",
    "edition": "Wikisource zh-hans HTML page scrape",
    "source_locator": "周易/蒙/易经/六五"
  },
  {
    "hexagram_seq": 4,
    "position": 6,
    "line_label": "上九",
    "text": "上九：击蒙，不利为寇，利御寇。",
    "source_id": "wikisource_zhouyi",
    "status": "checked",
    "edition": "Wikisource zh-hans HTML page scrape",
    "source_locator": "周易/蒙/易经/上九"
  },
  {
    "hexagram_seq": 5,
    "position": 1,
    "line_label": "初九",
    "text": "初九：需于郊，利用恒，无咎。",
    "source_id": "wikisource_zhouyi",
    "status": "checked",
    "edition": "Wikisource zh-hans HTML page scrape",
    "source_locator": "周易/需/易经/初九"
  },
  {
    "hexagram_seq": 5,
    "position": 2,
    "line_label": "九二",
    "text": "九二：需于沙，小有言，终吉。",
    "source_id": "wikisource_zhouyi",
    "status": "checked",
    "edition": "Wikisource zh-hans HTML page scrape",
    "source_locator": "周易/需/易经/九二"
  },
  {
    "hexagram_seq": 5,
    "position": 3,
    "line_label": "九三",
    "text": "九三：需于泥，致寇至。",
    "source_id": "wikisource_zhouyi",
    "status": "checked",
    "edition": "Wikisource zh-hans HTML page scrape",
    "source_locator": "周易/需/易经/九三"
  },
  {
    "hexagram_seq": 5,
    "position": 4,
    "line_label": "六四",
    "text": "六四：需于血，出自穴。",
    "source_id": "wikisource_zhouyi",
    "status": "checked",
    "edition": "Wikisource zh-hans HTML page scrape",
    "source_locator": "周易/需/易经/六四"
  },
  {
    "hexagram_seq": 5,
    "position": 5,
    "line_label": "九五",
    "text": "九五：需于酒食，贞吉。",
    "source_id": "wikisource_zhouyi",
    "status": "checked",
    "edition": "Wikisource zh-hans HTML page scrape",
    "source_locator": "周易/需/易经/九五"
  },
  {
    "hexagram_seq": 5,
    "position": 6,
    "line_label": "上六",
    "text": "上六：入于穴，有不速之客三人来，敬之终吉。",
    "source_id": "wikisource_zhouyi",
    "status": "checked",
    "edition": "Wikisource zh-hans HTML page scrape",
    "source_locator": "周易/需/易经/上六"
  },
  {
    "hexagram_seq": 6,
    "position": 1,
    "line_label": "初六",
    "text": "初六：不永所事，小有言，终吉。",
    "source_id": "wikisource_zhouyi",
    "status": "checked",
    "edition": "Wikisource zh-hans HTML page scrape",
    "source_locator": "周易/讼/易经/初六"
  },
  {
    "hexagram_seq": 6,
    "position": 2,
    "line_label": "九二",
    "text": "九二：不克讼，归而逋，其邑人三百户无眚。",
    "source_id": "wikisource_zhouyi",
    "status": "checked",
    "edition": "Wikisource zh-hans HTML page scrape",
    "source_locator": "周易/讼/易经/九二"
  },
  {
    "hexagram_seq": 6,
    "position": 3,
    "line_label": "六三",
    "text": "六三：食旧德，贞厉，终吉。或从王事，无成。",
    "source_id": "wikisource_zhouyi",
    "status": "checked",
    "edition": "Wikisource zh-hans HTML page scrape",
    "source_locator": "周易/讼/易经/六三"
  },
  {
    "hexagram_seq": 6,
    "position": 4,
    "line_label": "九四",
    "text": "九四：不克讼，复即命渝，安贞吉。",
    "source_id": "wikisource_zhouyi",
    "status": "checked",
    "edition": "Wikisource zh-hans HTML page scrape",
    "source_locator": "周易/讼/易经/九四"
  },
  {
    "hexagram_seq": 6,
    "position": 5,
    "line_label": "九五",
    "text": "九五：讼，元吉。",
    "source_id": "wikisource_zhouyi",
    "status": "checked",
    "edition": "Wikisource zh-hans HTML page scrape",
    "source_locator": "周易/讼/易经/九五"
  },
  {
    "hexagram_seq": 6,
    "position": 6,
    "line_label": "上九",
    "text": "上九：或锡之鞶带，终朝三褫之。",
    "source_id": "wikisource_zhouyi",
    "status": "checked",
    "edition": "Wikisource zh-hans HTML page scrape",
    "source_locator": "周易/讼/易经/上九"
  },
  {
    "hexagram_seq": 7,
    "position": 1,
    "line_label": "初六",
    "text": "初六：师出以律，否臧，凶。",
    "source_id": "wikisource_zhouyi",
    "status": "checked",
    "edition": "Wikisource zh-hans HTML page scrape",
    "source_locator": "周易/师/易经/初六"
  },
  {
    "hexagram_seq": 7,
    "position": 2,
    "line_label": "九二",
    "text": "九二：在师中吉，无咎；王三锡命。",
    "source_id": "wikisource_zhouyi",
    "status": "checked",
    "edition": "Wikisource zh-hans HTML page scrape",
    "source_locator": "周易/师/易经/九二"
  },
  {
    "hexagram_seq": 7,
    "position": 3,
    "line_label": "六三",
    "text": "六三：师或舆尸，凶。",
    "source_id": "wikisource_zhouyi",
    "status": "checked",